{
  "width": 16,
  "height": 12,
  "tiles": [
    "dense_jungle",
    "dense_jungle",
    "dense_jungle",
    "dense_jungle",
    "dense_jungle",
    "dense_jungle",
    "dense_jungle",
    "dense_jungle",
    "dense_jungle",
    "dense_jungle",
    "dense_jungle",
    "dense_jungle",
    "dense_jungle",
    "dense_jungle",
    "dense_jungle",
    "dense_jungle",
    "dense_jungle",
    "dense_jungle",
    "dense_jungle",
    "dense_jungle",
    "dense_jungle",
    "dense_jungle",
    "dense_jungle",
    "dense_jungle",
    "dense_jungle",
    "dense_jungle",
    "dense_jungle",
    "dense_jungle",
    "dense_jungle",
    "dense_jungle",
    "dense_jungle",
    "dense_jungle",
    "dense_jungle",
    "dense_jungle",
    "dense_jungle",
    "dense_jungle",
    "dense_jungle",
    "dense_jungle",
    "dense_jungle",
    "dense_jungle",
    "dense_jungle",
    "dense_jungle",
    "dense_jungle",
    "dense_jungle",
    "dense_jungle",
    "dense_jungle",
    "dense_jungle",
    "dense_jungle",
    "grass",
    "grass",
    "grass",
    "grass",
    "grass",
    "grass",
    "grass",
    "grass",
    "grass",
    "grass",
    "grass",
    "grass",
    "grass",
    "grass",
    "grass",
    "grass",
    "grass",
    "grass",
    "grass",
    "grass",
    "grass",
    "grass",
    "grass",
    "grass",
    "grass",
    "grass",
    "grass",
    "grass",
    "grass",
    "grass",
    "grass",
    "grass",
    "grass",
    "grass",
    "grass",
    "grass",
    "grass",
    "grass",
    "grass",
    "grass",
    "grass",
    "grass",
    "grass",
    "grass",
    "grass",
    "grass",
    "grass",
    "grass",
    "grass",
    "grass",
    "grass",
    "grass",
    "grass",
    "grass",
    "grass",
    "grass",
    "grass",
    "grass",
    "grass",
    "grass",
    "grass",
    "grass",
    "grass",
    "grass",
    "grass",
    "grass",
    "grass",
    "grass",
    "grass",
    "grass",
    "grass",
    "grass",
    "grass",
    "grass",
    "grass",
    "grass",
    "grass",
    "grass",
    "grass",
    "grass",
    "grass",
    "grass",
    "grass",
    "grass",
    "grass",
    "grass",
    "grass",
    "grass",
    "grass",
    "grass",
    "grass",
    "grass",
    "grass",
    "grass",
    "grass",
    "grass",
    "grass",
    "grass",
    "grass",
    "grass",
    "grass",
    "grass",
    "grass",
    "grass",
    "grass",
    "grass",
    "grass",
    "grass",
    "grass",
    "grass",
    "grass",
    "grass",
    "sand",
    "sand",
    "sand",
    "sand",
    "sand",
    "sand",
    "sand",
    "sand",
    "sand",
    "sand",
    "sand",
    "sand",
    "sand",
    "sand",
    "sand",
    "sand",
    "shallow_water",
    "shallow_water",
    "sand",
    "sand",
    "sand",
    "sand",
    "sand",
    "sand",
    "sand",
    "sand",
    "sand",
    "sand",
    "sand",
    "sand",
    "shallow_water",
    "shallow_water"
  ],
  "objects": [
    {
      "objectTypeId": "tree",
      "x": 3,
      "y": 4
    },
    {
      "objectTypeId": "tree",
      "x": 11,
      "y": 5
    },
    {
      "objectTypeId": "tree",
      "x": 6,
      "y": 7
    },
    {
      "objectTypeId": "tall_grass",
      "x": 4,
      "y": 6
    },
    {
      "objectTypeId": "tall_grass",
      "x": 9,
      "y": 6
    },
    {
      "objectTypeId": "tall_grass",
      "x": 12,
      "y": 8
    },
    {
      "objectTypeId": "small_rock",
      "x": 2,
      "y": 9
    },
    {
      "objectTypeId": "wreckage",
      "x": 10,
      "y": 10
    },
    {
      "objectTypeId": "rustic_table",
      "x": 8,
      "y": 8
    },
    {
      "objectTypeId": "bioluminescent_mushroom",
      "x": 9,
      "y": 9
    }
  ]
}
